{
  "catalogVersion": "4.90.0-123456-example",
  "changes": {
    "added": [],
    "changed": [],
    "removed": [],
    "unresolved": []
  },
  "generatedAt": "2026-07-16T12:00:00.000Z",
  "previousCatalogVersion": null,
  "schemaVersion": "1.0.0",
  "summary": {
    "abilitiesChanged": 0,
    "identifiersChanged": 0,
    "managersAdded": 0,
    "managersChanged": 0,
    "managersRemoved": 0,
    "spritesChanged": 0,
    "unresolvedObjects": 0,
    "warnings": 0
  }
}
