{
  "catalogVersion": "1.0.0-100000-test",
  "changes": {
    "added": [],
    "changed": [],
    "removed": [],
    "unresolved": []
  },
  "generatedAt": "2026-07-16T00:00:00.000Z",
  "previousCatalogVersion": "0.9.0-090000-old",
  "schemaVersion": "1.0.0",
  "summary": {
    "abilitiesChanged": 0,
    "identifiersChanged": 0,
    "managersAdded": 0,
    "managersChanged": 0,
    "managersRemoved": 0,
    "spritesChanged": 0,
    "unresolvedObjects": 15,
    "warnings": 0
  }
}
